{
  "$schema": "http://json-schema.org/draft-07/schema#",
  "title": "ActionsConfig",
  "type": "object",
  "properties": {
    "version": {"type": "string"},
    "bots": {"type": "array"},
    "reply_settings": {"type": "array"},
    "updated_at": {"type": "string"}
  },
  "required": ["bots"]
}
