{
  "version": "1.0",
  "bots": [
    {
      "account": {
        "id": 44,
        "account_name": "z8rm7",
        "api_key": "IevXsIqfaryVcvmHzGQLroVg0",
        "api_key_secret": "gr1dCQDrgkV0BqqnxKFD3M40nR0GW1cnIzveeZ4l46EUaI6QNh",
        "access_token": "1944304989293473792-QrY3CVkKfFXMZ3BeWnt1hFxltV34KO",
        "access_token_secret": "qr0Hchsopr92Os8Y6q9L7qcopVoxeMhGVZgNu6hY4n7mR",
        "status": "active"
      },
      "scheduled_content_list": "[\"みんな何してるの、、？\",\"起きた！！\",\"やほやほ\"]",
      "current_index": 0,
      "scheduled_times": "10:00"
    },
    {
      "account": {
        "id": 43,
        "account_name": "z8rm4",
        "api_key": "UVFbiNaNfpReGGDupP2mvuo8X",
        "api_key_secret": "pkgGNu785hyVeXfkyofQhwvhqjpKlkT8i8BJGjzrpu47YNFIOy",
        "access_token": "1944302970193231872-EEDDUS9xkbrYW69YNSa2DMkz1D4bH0",
        "access_token_secret": "Jk1gzmN0g86BjZgpVL6HwB2XuDfHF3AmV0Ah83gWzBSK6",
        "status": "active"
      },
      "scheduled_content_list": "[\"わあい！\",\"こんにちわ\",\"ないす！\"]",
      "current_index": 0,
      "scheduled_times": "07:00"
    },
    {
      "account": {
        "id": 37,
        "account_name": "z7rm2",
        "api_key": "XRFzQh1XnO1RKxzBicE6kwac2",
        "api_key_secret": "PT0TEfTxgXAeLTjsJvrby7LhG5SNaZxVgdifqecK4cdS5guiJd",
        "access_token": "1868751924474134528-CdFgzUBa9JxylJGnvg9xLPv8jGvPbS",
        "access_token_secret": "l4IA0pmfFJAdZGxI8MCqxmSdt19rVIxARBAN4UA3SglhD",
        "status": "active"
      },
      "scheduled_content_list": "[\"おはよ～\",\"やっほー！\"]",
      "current_index": 0,
      "scheduled_times": "07:00"
    },
    {
      "account": {
        "id": 34,
        "account_name": "z6rm5",
        "api_key": "jZzxeNM7o8QExVGjFWsMc3n2J",
        "api_key_secret": "XE2HGYaUVWLryefm91tblKKX6u8pi5Bp4ujZPytjpOkbvfU7Fe",
        "access_token": "1868982781310853120-Db7lmOZ1I9EfvDQ9X895rc0K5R3aFU",
        "access_token_secret": "jA3BBqPffqgfQVv6hTtiQUhP4XsoZhB84wCDNGUbZ2EaG",
        "status": "active"
      },
      "scheduled_content_list": "[\"種付けプレスしてください🥺\\n\",\"明日会う人にドタキャンされた😭\\n誰か会えませんか、？\\nシたすぎてヤバいです笑\",\"せふ募集中です🥺\\n反応くれたらDMいきます！！\",\"女子大なので出会いありません😢\",\"13cm以上ある人いませんか、？笑\\n奥ぐりぐりして下さい🥺\",\"誰か生で大人しませんーー？\\n急募です\",\"住み近い人いないのかな、、？\",\"DMいってもいい人いるかな、？\",\"奥ガン突きできる方いませんか、？🥺\",\"変態さん、いませんか、？笑\",\"せいよくめっちゃやばいです。それでも大丈夫ですか？声かけてね\",\"さみしいです、、( ; ; )\\n不健全でもいいので誰か会えませんか？？\",\"ドMでもいいかな🥺\",\"彼氏に振られました😭\\nさみしいです、、、🥺\",\"さみしい、、、\",\"横浜周辺で今から会える人ーー！！\",\"性欲強すぎてフラれた😭\\n大丈夫な人いないかな、、、\",\"またXの人と会えなかった😭😭\\nもうやだ、業者しかいないの、、？\",\"お家デートしたいー！！\",\"性欲強い人いませんか、？🥺\",\"今週どこかで会える人いませんかっ！\\n反応くれたらDMいきます！\\n相性よさそうだったら遊びましょ🫶\\nJDなのでお酒飲めますっ！\",\"雑魚マンでもいいですか、？🥺\",\"ドMでもいいよ～🙋‍♂️って人いませんか、？\\nイジメてください🥺\\n反応くれたらDMいきます！\",\"今日暇すぎる会お。。。\",\"やりもくの人いますか、？笑\",\"みんなどこ住んでるのー？？\\n近い人あそぼ🫶\",\"ホントに会える方いませんか、？\\n冷やかし要りません😡\",\"定期的に会える方いませんか、、？\",\"うう、、むらむらする、、、🥺\",\"ホントに会える方いませんか、？\",\"急ですけど、今日会える方いませんか？🥺\",\"住み近い人あそびませんか？笑\\n1人暮らしです！！\",\"会える人いませんか、、？\",\"むらむらする、、\",\"生中したい人いませんか、？笑\",\"Xで会う約束してた人にドタキャンされました😭\\nホントに会える人だけ反応ください🥺\",\"今からひとりでするからシコってほしい\\n\\n#いいねでDM #裏アカ女子\",\"むらむらヤバいよぉ🥺\",\"今から対戦できる人いませんか、？笑\",\"おち〇ちんください🥺\",\"横浜で会える方いませんか、、？\",\"ピル飲んでます！笑\",\"今週末会える人いませんか？( ; ; )\\n反応くれたらDMいきます！！\",\"横浜の近くに住んでる人いませんかっ！\",\"ぼっきしてる人だけいいねください。\\n\\n#いいねでDM\",\"クリしこしこきもちい🥺\",\"10cm以上ある方いますか？\\n個人的にDMいくかも\",\"1人暮らしです、、\\nさみしいので誰か会えませんか、？\",\"下心のいいね、いっぱいしてみて？\\n\\n#いいねでDM\",\"えっちしたい、、、\",\"奥ぐりぐりされるのすき🥺\",\"オナホみたいに扱われたい笑\"]",
      "current_index": 0,
      "scheduled_times": "01:00,13:00,22:00"
    },
    {
      "account": {
        "id": 32,
        "account_name": "z6rm3",
        "api_key": "u37tEcyNH3i0ya05Qx2OSwtsp",
        "api_key_secret": "e3sFk01UIVluUmeRQmnLjnoAXICoEslCalYXexsVVrWC0yWM4w",
        "access_token": "1868059083133374464-LaD87EI9P6YkoN6ESbtN99pVzSQbll",
        "access_token_secret": "GL0Q72OJmk6ubDjxvetco9QNgvahpKgHsZY9G2lac9w3D",
        "status": "active"
      },
      "scheduled_content_list": "[\"みんなどこ住んでるのー？？\\n近い人あそぼ🫶\",\"急ですけど、今日会える方いませんか？🥺\",\"今週末会える人いませんか？( ; ; )\\n反応くれたらDMいきます！！\",\"さみしい、、、\",\"Xで会う約束してた人にドタキャンされました😭\\nホントに会える人だけ反応ください🥺\",\"住み近い人いないのかな、、？\",\"13cm以上ある人いませんか、？笑\\n奥ぐりぐりして下さい🥺\",\"ホントに会える方いませんか、？\",\"下心のいいね、いっぱいしてみて？\\n\\n#いいねでDM\",\"せいよくめっちゃやばいです。それでも大丈夫ですか？声かけてね\",\"定期的に会える方いませんか、、？\",\"せふ募集中です🥺\\n反応くれたらDMいきます！！\",\"変態さん、いませんか、？笑\",\"雑魚マンでもいいですか、？🥺\",\"彼氏に振られました😭\\nさみしいです、、、🥺\",\"クリしこしこきもちい🥺\",\"おち〇ちんください🥺\",\"千葉で会える方いませんか、、？\",\"住み近い人あそびませんか？笑\\n1人暮らしです！！\",\"ホントに会える方いませんか、？\\n冷やかし要りません😡\",\"ドMでもいいよ～🙋‍♂️って人いませんか、？\\nイジメてください🥺\\n反応くれたらDMいきます！\",\"今日暇すぎる会お。。。\",\"またXの人と会えなかった😭😭\\nもうやだ、業者しかいないの、、？\",\"今からひとりでするからシコってほしい\\n\\n#いいねでDM #裏アカ女子\",\"やりもくの人いますか、？笑\",\"女子大なので出会いありません😢\",\"ぼっきしてる人だけいいねください。\\n\\n#いいねでDM\",\"お家デートしたいー！！\",\"むらむらする、、\",\"DMいってもいい人いるかな、？\",\"今週どこかで会える人いませんかっ！\\n反応くれたらDMいきます！\\n相性よさそうだったら遊びましょ🫶\\nJDなのでお酒飲めますっ！\",\"さみしいです、、( ; ; )\\n不健全でもいいので誰か会えませんか？？\",\"性欲強い人いませんか、？🥺\",\"千葉周辺で今から会える人ーー！！\",\"うう、、むらむらする、、、🥺\",\"今から対戦できる人いませんか、？笑\",\"会える人いませんか、、？\",\"種付けプレスしてください🥺\",\"千葉の近くに住んでる人いませんかっ！\",\"10cm以上ある方いますか？\\n個人的にDMいくかも\",\"むらむらヤバいよぉ🥺\",\"性欲強すぎてフラれた😭\\n大丈夫な人いないかな、、、\",\"1人暮らしです、、\\nさみしいので誰か会えませんか、？\",\"明日会う人にドタキャンされた😭\\n誰か会えませんか、？\\nシたすぎてヤバいです笑\",\"生中したい人いませんか、？笑\",\"奥ガン突きできる方いませんか、？🥺\",\"ピル飲んでます！笑\",\"誰か生で大人しませんーー？\\n急募です\",\"ドMでもいいかな🥺\"]",
      "current_index": 1,
      "scheduled_times": "21:00,23:00"
    },
    {
      "account": {
        "id": 16,
        "account_name": "z4rm1",
        "api_key": "6hFQGUbUrdtnH2z7WBm1r8Qwh",
        "api_key_secret": "sOq19RD07zLimkIAcgLXWzk85wQOLNXM81WzJKOk27DmofdOyJ",
        "access_token": "1839576667347734528-3b1avnPioVyfobD82tYBkd1xbtml4Y",
        "access_token_secret": "t1qzm4ErHgouV3gsrIRF4OeYGsXsQbbS1P9CT4TZNKPXb",
        "status": "active"
      },
      "scheduled_content_list": "[\"やりもくの人いますか、？笑\\n\",\"変態さん、いませんか、？笑\",\"性欲強い人いませんか、？🥺\",\"うう、、むらむらする、、、🥺\",\"さみしい、、、\",\"1人暮らしです、、\\nさみしいので誰か会えませんか、？\",\"定期的に会える方いませんか、、？\",\"みんなどこ住んでるのー？？\\n近い人あそぼ🫶\",\"梅田で会える方いませんか、、？\",\"生中したい人いませんか、？笑\",\"むらむらする、、\",\"梅田の近くに住んでる人いませんかっ！\",\"性欲強すぎてフラれた😭\\n大丈夫な人いないかな、、、\",\"明日会う人にドタキャンされた😭\\n誰か会えませんか、？\\nシたすぎてヤバいです笑\",\"住み近い人いないのかな、、？\",\"さみしいです、、( ; ; )\\n不健全でもいいので誰か会えませんか？？\",\"せふ募集中です🥺\\n反応くれたらDMいきます！！\",\"誰か生で大人しませんーー？\\n急募です\",\"せいよくめっちゃやばいです。それでも大丈夫ですか？声かけてね\",\"またXの人と会えなかった😭😭\\nもうやだ、業者しかいないの、、？\",\"女子大なので出会いありません😢\",\"今から対戦できる人いませんか、？笑\",\"ホントに会える方いませんか、？\",\"ドMでもいいよ～🙋‍♂️って人いませんか、？\\nイジメてください🥺\\n反応くれたらDMいきます！\",\"ぼっきしてる人だけいいねください。\\n\\n#いいねでDM\",\"クリしこしこきもちい🥺\",\"奥ガン突きできる方いませんか、？🥺\",\"下心のいいね、いっぱいしてみて？\\n\\n#いいねでDM\",\"10cm以上ある方いますか？\\n個人的にDMいくかも\",\"会える人いませんか、、？\",\"13cm以上ある人いませんか、？笑\\n奥ぐりぐりして下さい🥺\",\"雑魚マンでもいいですか、？🥺\",\"おち〇ちんください🥺\",\"急ですけど、今日会える方いませんか？🥺\",\"今週末会える人いませんか？( ; ; )\\n反応くれたらDMいきます！！\",\"ホントに会える方いませんか、？\\n冷やかし要りません😡\",\"ピル飲んでます！笑\",\"Xで会う約束してた人にドタキャンされました😭\\nホントに会える人だけ反応ください🥺\",\"種付けプレスしてください🥺\",\"住み近い人あそびませんか？笑\\n1人暮らしです！！\",\"彼氏に振られました😭\\nさみしいです、、、🥺\",\"今週どこかで会える人いませんかっ！\\n反応くれたらDMいきます！\\n相性よさそうだったら遊びましょ🫶\\nJDなのでお酒飲めますっ！\",\"今からひとりでするからシコってほしい\\n\\n#いいねでDM #裏アカ女子\",\"梅田周辺で今から会える人ーー！！\"]",
      "current_index": 1,
      "scheduled_times": "11:00,19:00,22:00"
    },
    {
      "account": {
        "id": 11,
        "account_name": "z2rm9",
        "api_key": "ofViZlyIwKtzjwGB6BtIv8LqE",
        "api_key_secret": "37GZSdNskxGyrf9c0tC8hPTutocQiBiq484YR6xtqI4deiEtL8",
        "access_token": "1838936883663167488-yssmaFnK6CotRP3ElOblSSLGDj4S7h",
        "access_token_secret": "AjHDg1bxYhTH92MJbtOjQBKbLwLcHUpVljMogdknqWep4",
        "status": "active"
      },
      "scheduled_content": null,
      "scheduled_times": null
    },
    {
      "account": {
        "id": 10,
        "account_name": "z2rm8",
        "api_key": "cAhnbcu2Gy9k8KnCIH5RFiPDb",
        "api_key_secret": "kvixnsSNlELD3bThkqnW9SmInZQPRYAjCDjCMrldSCFgeyoC86",
        "access_token": "1837728480588713985-oiLy1xWEn7kTJuwK8NOeigFKYMdE5T",
        "access_token_secret": "webb5ZxZ5DZkCwOihGTWljcfBVdqsQHI9Hjb3QgKKJmkI",
        "status": "active"
      },
      "scheduled_content_list": "[\"⬛️⬛️⬛️⬛️⬛️⬛️⬛️⬛️⬛️⬛️⬛️⬛️\\n\\n                          お題\\n\\n　   永久保存のおかずにしたい\\n\\n　              たぬき顔 巨 乳\\n\\n　　　🟧🟧🟧🟧🟧🟧🟧🟧\\n　　　　　　選手権\\n　　　🟧🟧🟧🟧🟧🟧🟧🟧\\n\\n⬛️⬛️⬛️⬛️⬛️⬛️⬛️⬛️⬛️⬛️⬛️⬛️\"]",
      "current_index": 0,
      "scheduled_times": "00:00"
    },
    {
      "account": {
        "id": 9,
        "account_name": "z2rm6",
        "api_key": "qOKrtQdIdltsMG8f7J1iJuLgk",
        "api_key_secret": "7MxqSei8X0nbzZjITVZgTpO9ItqBkqACJ9YBOhdKktxh9mY8dJ",
        "access_token": "1837577948213530625-nDldjY2xBfXvC3EjK7Qk8qSnRQ5LKr",
        "access_token_secret": "6Zge88TH5GA6GSf4wm1OtwLk6c9syTw4Uvhz3nH6a7PB6",
        "status": "active"
      },
      "scheduled_content": null,
      "scheduled_times": null
    },
    {
      "account": {
        "id": 8,
        "account_name": "z2rm4",
        "api_key": "WOSI3K6O7YlTMY9GvnaZrOXR4",
        "api_key_secret": "gMShTo2w7uPvj7hd0kHFHo2ZCHD24bobXJv6MvH1tfDqE6GLlh",
        "access_token": "1836827332134514688-VLzx4Spvf74dMi0ButxKBrqcnhNsVZ",
        "access_token_secret": "FH804OtsGWmhA9THLwvFSp9CvfkPWVFt0PG7aAdJtRzdb",
        "status": "active"
      },